{
  "name":"hsc-dev",
  "artifacts":[
    {
      "type":"maven",
      "value":{
        "groupId":"org.crudem",
        "artifactId":"bahmni-distro-hsc",
        "version":"1.1.0-SNAPSHOT",
        "packaging":"zip"
      }
    }
  ],
  "deployment":{
    "hostDir":"/var/volume/bahmni",
    "type":"dockerCompose",
    "value":{
      "networks":[
        "network1"
      ],
      "commitId":"origin/INFRA-224",
      "gitUrl":"https://github.com/chinzou/bahmni-docker.git"
    },
    "host":{
      "type":"ssh",
      "value":{
        "ip":"172.10.0.1",
        "user":"centos",
        "port":"22"
      }
    },
    "links":[],
    "timezone":"America/Port-au-Prince"
  },
  "description":"Dev server for agile development for HSC",
  "group":"hsc",
  "type":"dev",
  "version":"1.0.0",
  "properties":[
    {
      "filename":"erp.properties",
      "path":"/etc/properies",
      "service": "openmrs",
      "properties":{
        "erp.host":"${ODOO_HOST}",
        "erp.port":"${ODOO_PORT}",
        "erp.user":"${ODOO_USER}",
        "erp.password":"${ODOO_PASSWORD}",
        "erp.database":"${ODOO_DB}"
      }
    }
  ],
  "envVars":{
    "OPENMRS_OWAS_PATH":"/var/volume/bahmni/artifacts/openmrs_core",
    "OPENMRS_MODULES_PATH":"/var/volume/bahmni/artifacts/openmrs_modules",
    "OPENMRS_CONFIG_PATH":"/var/volume/bahmni/artifacts/openmrs_config",
    "BAHMNI_CONFIG_PATH":"/var/volume/bahmni/artifacts/bahmni_config",
    "BAHMNI_APPS_PATH":"/var/volume/bahmni/artifacts/bahmni_emr/bahmniapps",
    "ODOO_EXTRA_ADDONS":"/var/volume/bahmni/artifacts/odoo_addons",
    "ODOO_CONFIG_PATH":"/var/volume/bahmni/artifacts/odoo_config"
  }
}