{
  "name": "test2-dev",
  "uuid": "54421f4a-2a4c-485e-a0b9-0463227f7c7e",
  "active": false,
  "artifacts": [
    {
      "type": "maven",
      "value": {
        "groupId": "org.crudem",
        "artifactId": "bahmni-distro-hsc",
        "version": "1.2.0-SNAPSHOT",
        "packaging": "zip"
      }
    }
  ],
  "deployment": {
    "hostDir": "/var/docker-volumes/bahmni",
    "type": "dockerComposeMaven",
    "value": {
      "mavenProject": {
        "groupId": "net.mekomsolutions",
        "artifactId": "bahmni-docker-compose",
        "version": "2.0.0-SNAPSHOT",
        "packaging": "zip"
      },
      "services": [
        "proxy",
        "openmrs",
        "mysql",
        "bahmni-home",
        "bahmniapps",
        "bahmni-config",
        "appointments",
        "bahmni-reports",
        "postgresql",
        "odoo",
        "eip-client"
      ]
    },
    "host": {
      "type": "ssh",
      "value": {
        "ip": "172.20.0.1",
        "user": "zou",
        "port": "22"
      }
    },
    "links": [],
    "timezone": "America/Port-au-Prince",
    "maintenanceUrl": "http://maintenance/maintenance/"
  },
  "description": "Dev server for agile development for HSC",
  "group": "hsc",
  "type": "dev",
  "version": "1.0.0",
  "properties": [
    {
      "filename": "erp.properties",
      "path": "/etc/properties",
      "service": "openmrs",
      "properties": {
        "erp.host": "${ODOO_HOST}",
        "erp.port": "${ODOO_PORT}",
        "erp.user": "${ODOO_USER}",
        "erp.password": "${ODOO_PASSWORD}",
        "erp.database": "${ODOO_DB}"
      }
    }
  ],
  "envVars": {
    "PROXY_PUBLIC_PORT": "80",
    "PROXY_PUBLIC_PORT_TLS": "443",
    "PROXY_TLS_CERTS_PATH": "/etc/ssl/hsc-cd.mekomsolutions.net",
    "PROXY_TLS": "-DenableTLS",
    "OPENMRS_OWAS_PATH":
      "/var/docker-volumes/bahmni/hsc-dev/artifacts/openmrs_core",
    "OPENMRS_MODULES_PATH":
      "/var/docker-volumes/bahmni/hsc-dev/artifacts/openmrs_modules",
    "OPENMRS_CONFIG_PATH":
      "/var/docker-volumes/bahmni/hsc-dev/artifacts/openmrs_config",
    "BAHMNI_CONFIG_PATH":
      "/var/docker-volumes/bahmni/hsc-dev/artifacts/bahmni_config",
    "BAHMNI_APPS_PATH":
      "/var/docker-volumes/bahmni/hsc-dev/artifacts/bahmni_emr/bahmniapps",
    "BAHMNI_OBSCALCULATOR_PATH":
      "/var/docker-volumes/bahmni/hsc-dev/artifacts/bahmni_config/openmrs/obscalculator/",
    "ODOO_EXTRA_ADDONS":
      "/var/docker-volumes/bahmni/hsc-dev/artifacts/odoo_addons",
    "ODOO_CONFIG_PATH":
      "/var/docker-volumes/bahmni/hsc-dev/artifacts/odoo_config",
    "ODOO_PUBLIC_PORT": "8069",
    "EIP_CONFIG_PATH":
      "/var/docker-volumes/bahmni/hsc-dev/artifacts/eip_config",
    "DISTRO_PATH": "/var/docker-volumes/bahmni/hsc-dev/artifacts"
  },
  "scripts": [
    {
      "type": "shell",
      "service": "openmrs",
      "executionStage": "6",
      "conditions": ["data", "artifacts", "deployment"],
      "value":
        "echo \"Replace startup monitoring by a simple time delay. Waiting for 5m...\"; /bin/sleep 5m"
    }
  ]
}
