{
  "uuid": "08f23545-04c5-4245-aff4-25ce385f9ec3",
  "name": "hsc-dev",
  "artifacts": [
    {
      "type": "maven",
      "value": {
        "groupId": "org.crudem",
        "artifactId": "bahmni-distro-hsc",
        "version": "1.1.0-SNAPSHOT",
        "packaging": "zip"
      }
    }
  ],
  "deployment": {
    "hostDir": "/var/docker-volumes/bahmni/hsc-dev",
    "type": "docker",
    "value": {
      "networks": [
        "network1"
      ],
      "image": "mekomsolutions/bahmni",
      "tag": "emr_erp_infra_223",
      "ports": {
        "443": "8910",
        "8069": "8069"
      },
      "privileged": "true"
    },
    "host": {
      "type": "ssh",
      "value": {
        "ip": "172.17.0.1",
        "user": "zou",
        "port": "22"
      }
    },
    "links": [],
    "selinux": "false",
    "timezone": "America/Port-au-Prince",
    "maintenanceUrl": "http://maintenance/maintenance/"
  },
  "scripts": [
    {
      "type": "shell",
      "executionStage": "5",
      "conditions": [
        "deployment"
      ],
      "value": "/opt/bahmni-utils-scripts/start_bahmni.sh"
    },
    {
      "type": "shell",
      "executionStage": "6",
      "conditions": [
        "data",
        "artifacts",
        "deployment"
      ],
      "value": "echo \"Replace startup monitoring by a simple time delay. Waiting for 5m...\"; /bin/sleep 5m"
    },
    {
      "type": "shell",
      "executionStage": "7",
      "conditions": [
        "data",
        "deployment"
      ],
      "value": "echo \"UPDATE global_property SET global_property.property_value = '' WHERE global_property.property = 'search.indexVersion';\" | mysql -uopenmrs-user -pP@ssw0rd openmrs"
    }
  ],
  "description": "Dev server for agile development for HSC",
  "group": "hsc",
  "type": "dev",
  "version": "1.0.0",
  "properties": [
    {
      "filename": "erp.properties",
      "path": "/opt/openmrs/",
      "properties": {
        "erp.host": "localhost",
        "erp.port": "8069",
        "erp.user": "admin",
        "erp.password": "admin",
        "erp.database": "odoo"
      }
    }
  ]
}
